Title,Authors,Abstract,URL,Paper ID
New Product Development and Consumer Brand Adoption in SMEs Manufacturing Industry in Ogun State Nigeria,"Kesinro Or, A. Aa, Ademilua Av","The study examines the effect of New Product Development strategies on Consumer Brand Adoptionin SMEs in the manufacturing industry in Ogun State, Nigeria. The main objective of the study is to determine the relationships between brand physical attributes, buyer behaviour, market pre-testing strategy, product adoption, marketing planning policy and competitive edge of SMEs products in Ado-odo/Ota Local Government Area of Ogun State, Nigeria. The research design is the descriptive survey and data were gathered through a well-structured questionnaire rated on a 6-point Likert scale of Strongly Agree to Strongly Disagree. The population of the study comprised 240 ownermanagers and employees of selected companies presumed to host most of the SMEs in the state. The simple random sampling technique was used to select a sample of 150 individuals. 134 copies of the questionnaire were returned and analyzed using the percentile and simple regression statistical techniques. The study reveals that physical attributes of SMEs products have significant weak relationship with buyer behaviour (R=0.333; p<0.05); there is significant moderate relationship between market pre-testing strategy and adoption of product (R=0.342; p<0.05) and there is significant but weak relationship between marketing planning policy and improve competitive edge of SMEs products (R=0.125, p<0.05). The study recommends that small businesses periodically review the techniques employed in product development to enhance brand image and consumer expectation that guarantee consumer loyalty.",https://www.semanticscholar.org/paper/a0063f6b8a0d4b008cdc7e8530769adabae5c2ef,a0063f6b8a0d4b008cdc7e8530769adabae5c2ef
IDEAS: Immersive Dome Experiences for Accelerating Science,"J. Faherty, Mark SubbaRao, Ryan Wyatt, A. Ynnerman, Neil De Grasse Tyson, Aaron M. Geller, Maria A. Weber, Philip Rosenfield, Wolfgang Steffen, Gabriel Stoeckle, D. Weiskopf, Marcus A. Magnor, Peter. K. G. Williams, Brian Abbott, Lucia Marchetti, Thomas H. Jarrett, Jonathan Fay, Joshua E. G. Peek, O. Graur, P. Durrell, Derek Homeier, H. Preston, Thomas Müller, J. Vos, David Brown, Paige A. Giorla Godfrey, Emily L. Rice, D. B. Gagliuffi, A. Bock",,https://www.semanticscholar.org/paper/9364bf34d1dd21ffa82244dd338487b376fe3195,9364bf34d1dd21ffa82244dd338487b376fe3195
NON-LEGAL SANCTIONS IN INTERNATIONAL LAW,"Shai Dothan, K. Alter, Patrick Barry, Or Bassok, E. Benvenisti, Lisa E. Bernstein, A. Cohen, Yoav Dothan, Olga Frishman, Rotem Giladi, Thomas B. Ginsburg, F. Hampson, L. Helfer, Saggi Katz, Michal Lavi, C. McCrudden, I. Panagis",,https://www.semanticscholar.org/paper/1a15af891382df5837fca7283afb863f792480d3,1a15af891382df5837fca7283afb863f792480d3
“A seed blessed by the Lord”: the role of religious references in the creation of Modern Hebrew,Iair G. Or,,https://www.semanticscholar.org/paper/0e70edb1606401568a2bb48f8ef15407cc802f0a,0e70edb1606401568a2bb48f8ef15407cc802f0a
UvA-DARE (Digital Academic Repository) Scripting the Collaboration for Exploiting the Learning Affordances of a Modeling Environment Scripting the Collaboration for Exploiting the Learning Affordances of a Modeling Environment,"R. Or-Bach, B. Bredeweg",,https://www.semanticscholar.org/paper/dc0e67a3456dcca7b83a267efbed20d5ae05436d,dc0e67a3456dcca7b83a267efbed20d5ae05436d
following Kingdom : Plantae Phylum : Magnoliophyta Class : Angiospermae Order : Malpighiales Family : Euphorbiaceae Genus : Euphorbia Species :,"A. Mamun-Or-Rashid, S. Mahmud, N. Towfique, M. K. Sen",,https://www.semanticscholar.org/paper/aaa97eeb8fa47f08d16b5d361f78166c1da3a803,aaa97eeb8fa47f08d16b5d361f78166c1da3a803
Magnetic Field Analysis for a Distribution Transformer with Unbalanced Load Conditions by using 3-D Finite Element Method,"P. Meesuk, T. Kulworawanichpong, P. Pao-la-or",,https://www.semanticscholar.org/paper/8b29c98649573092e342d57393cee92a9e9a766e,8b29c98649573092e342d57393cee92a9e9a766e
"The Importance of Emphasizing Individual Learning in the ""Collaborative Learning Era""","A. Yadin, R. Or-Bach",,https://www.semanticscholar.org/paper/74ab4e098bc56aad5696da38eba777a6947d9d28,74ab4e098bc56aad5696da38eba777a6947d9d28
DOES NOT EXTEND TO OTHER TYPES OF REPRODUCTION NOR TO COPYING FOR INCORPORATION INTO COMMERCIAL ADVERTISING NOR FOR ANY OTHER PROFIT,"H. Ha, Ar Rb, Bo Or, A. Bruzzone, Francesco Longo, M. A. Piera, Enrico Bocca, E. Bottani, E. Cepolina, Francesco Costantino, Univ Of Rome, La Sapienza, Toni Guasch, F. Madeo, T. Murino, Galina V. Merkuryeva, R. Montanari, F. Tarone, A. Tremori",,https://www.semanticscholar.org/paper/8872948ebb7f44e18a3a8227b156934609341159,8872948ebb7f44e18a3a8227b156934609341159
Growth In The Fast Lane: Land Values and Urban Growth of Istanbul,M. Sinan,,https://www.semanticscholar.org/paper/2ab9fb1dcb6911fbd29e695d8527eac8480546d7,2ab9fb1dcb6911fbd29e695d8527eac8480546d7
Absorbing shocks : Designing an agriculture vegetative waste management system resilient to final product price fluctuations,"Dani Broitman, O. Raviv, O. Ayalon, I. Kan",,https://www.semanticscholar.org/paper/1f77abbb3a32303ecb29945607c23b21527a53b0,1f77abbb3a32303ecb29945607c23b21527a53b0
PC3 - 138 Stereotactic Radiosurgery for Intracranial Hemangiopericytomas – A Multicenter Study,O. Cohen-Inbar,"Hemangiopericytomas (HPC) are widely recognized for their aggressive clinical behavior. We report a large multicenter study, through the International Gamma Knife Research Foundation reviewing management and outcome following stereotactic radiosurgery (SRS) for recurrent or newly-discovered HPC’s. Methods: Eight centers participated, reviewing a total of 90 patients harboring 133 tumors. Prior treatments included embolization (n = 8), chemotherapy (n=2), and fractionated radiotherapy (n=34). The median tumor volume at the time of SRS was 4.9 ml (range 0.2-42.4 ml). WHO-grade II (typical) HPC’s formed 78.9% (n=71) of the cohort. The median margin and maximal doses delivered were 15 Gy (2.8-24) and 32 Gy (8-51), respectively. The median clinical and radiographic follow-up period was 59 months (6-190) and 59 months (6-183), respectively. Results: At last follow-up, 55% of tumors and 62.2% of patients demonstrated local tumor control. New remote intracranial tumors were found in 27.8%. 24.4% of patients developed extra-cranial metastases. Adverse radiation effects were noted in 6.7%. The overall survival was 91.5%, 82.1%, 73.9%, 56.7%, and 53.7% at 2, 4, 6, 8, and 10 years, respectively, after initial SRS. Local progression free survival was 81.7%, 66.3%, 54.5%, 37.2%, and 25.5% at 2, 4, 6, 8, and 10 years, respectively, after initial SRS. In our cohort, 32 patients underwent 48 repeat SRS procedures for 76 lesions. Margin dose greater than 16 Gy (p=0.037) and tumor histology (p=0.006) were shown to influence PFS. Conclusions: SRS provides a reasonable rate of local tumor control and a low risk of adverse effects",https://www.semanticscholar.org/paper/4d68ab9ee80f7c8f23481c963e27ecfc6b9a149c,4d68ab9ee80f7c8f23481c963e27ecfc6b9a149c
Critique of a Language-Learning Website,Soh Or Kan,,https://www.semanticscholar.org/paper/4a7e880b8597725d5e967203157dd376c57c3c13,4a7e880b8597725d5e967203157dd376c57c3c13
Optimizing Subcritical-Flow Thrust-Vectoring of Converging -Diverging Nozzles,"E. Wilson,, D. Adler, Benjamin Z. Bal-Or, V. Sherbaum,, M. Lichtsinder","Engine thrust vectoring (TV) is a potential technology for military and future civil aircraft in which the Technion— Israel Institute of Technology has made signie cant contributions. This paper provides realistic predictions of steady-state engine performance during steady-state pitch vectoring. The results obtained comprise a required fundamental step for advanced aircraft/TV implementation. This work is a part of the Lockheed Martin yaw‐pitch TV F-16/F-100 research study conducted here at the Jet Laboratory. To this end, a unique TV-engine computer algorithm has been developed that expands the conventional steady-state modeling capabilities of onand off-design as well as the conventional transients (via throttle changes ) to create steady-state and dynamic TV‐engine simulations at various altitudes and Mach numbers. This paper reviews the steady-state performances and the optimization observations initially obtained. The subcritical e ow realm of nozzle performance provides trends aiding in the prediction of thrust benee ts beyond the conventional nozzle design of the F100 model are available as the effective nozzle throat area is allowed to contract through vectoring.",https://www.semanticscholar.org/paper/32058f204b7c24bfa80c0184c89ae778ec0a7a25,32058f204b7c24bfa80c0184c89ae778ec0a7a25
Congestion Avoidance and Fair Event Detection in Wireless Sensor Network,"Md. Mamun-Or-Rashid, M. Alam, M. Razzaque, C. Hong","Summary Congestion in WSN increases the energy dissipation rates of sensor nodes as well as the loss of packets and thereby hinders fair and reliable event detection. We find that one of the key reasons of congestion in WSN is allowing sensing nodes to transfer as many packets as possible. This is due to the use of CSMA/CA that gives opportunistic medium access control. In this paper, we propose an energy efficient congestion avoidance protocol that includes source count based hierarchical and load adaptive medium access control and weighted round robin packet forwarding. We also propose in-node fair packet scheduling to achieve fair event detection. The results of simulation show our scheme exhibits more than 90% delivery ratio even under bursty traffic condition which is good enough for reliable event perception. Key words: Sensor Network, Congestion Avoidance, Hierarchical Medium Access, Fair Event Detection. 1. Introduction Wireless Sensor Networks (WSNs) are densely deployed for a wide range of applications in the military, health, environment, agriculture and smart office domain. These networks deliver numerous types of traffic, from simple periodic reports to unpredictable bursts of packets triggered by sensed events. Therefore, congestion happens due to contention caused by concurrent transmissions, buffer overflows and time varying wireless channel condition [1][2][3]. As WSN is a multi-hop network, congestion taking place at a single node may diffuse to the whole network and degrades its performance drastically [4]. Congestion causes many folds of drawbacks: (i) it increases energy dissipation rates of sensor nodes, (ii) it causes a lot of packet loss, which in turn diminish the network throughput, and (iii) it hinders fair event detections and reliable data transmissions. Therefore, congestion avoidance and fair packet delivery become a crucial research issue for the practical realization of WSN based envisioned applications.",https://www.semanticscholar.org/paper/757c92a41495fcfd66723c657bb8cf2a2dc39236,757c92a41495fcfd66723c657bb8cf2a2dc39236
ON EQUITABLE RESOURCE ALLOCATION PROBLEMS: A LEXICOGRAPHIC MINIMAX APPROACH,Or Chronicle,,https://www.semanticscholar.org/paper/2859ea8a285f725df26ff8bd7a8c3c63314e6d69,2859ea8a285f725df26ff8bd7a8c3c63314e6d69
A biologically inspired CPG-ZMP control system for the real-time balance of a single-legged belly dancing robot,"Jimmy Or, A. Takanishi","Recently, a few researchers have started to realize that in order for humanoid robots to move more naturally, it is necessary for them to incorporate a flexible spine in their robots. So far, nobody has come out with a solution which allows their spine robots to maintain balance in real-time. This paper presents a biologically inspired, hybrid CPG-ZMP controller for a single-legged, flexible spine belly dancing robot. Using only two control parameters, our robot can generate rhythmic and wave-like spine motions through the CPG component. By monitoring the torque at the robot's ankle, the ZMP component allows the robot to maintain balance in real-time. Unlike traditional ZMP-based controllers, no modeling of the robot's dynamics or explicit computations of the zero moment point are required. The resultant robot's motions emerge automatically in real-time through dynamic interactions between the robot, its neural network and the environment. Experimental results indicate that our controller has the potential to be applied to a new generation of flexible spine, biped walking humanoid robots.",https://www.semanticscholar.org/paper/659ebdff34ddf9215f988a27acca4328b6837f10,659ebdff34ddf9215f988a27acca4328b6837f10
Role of the physician and physical education teacher in the treatment of obesity at school.,"D. Ward, O. Bar-or",,https://www.semanticscholar.org/paper/b80c97d6952124d9f615495fb22d482c2dd9983a,b80c97d6952124d9f615495fb22d482c2dd9983a
Private Party Direct Access: A Comparison of the NAFTA and the EU Disciplines,N. Gal‐Or,,https://www.semanticscholar.org/paper/010c37c1d876fa6bd02bf8bbd23b9c43dc245c92,010c37c1d876fa6bd02bf8bbd23b9c43dc245c92
"ARTIFICIAL INTELLIGENCE: ENGINEERING, SCIENCE,","Or Slogan, N. Nilsson",,https://www.semanticscholar.org/paper/beba8e9823adc3cbb009a7d0ea7f542900a9817c,beba8e9823adc3cbb009a7d0ea7f542900a9817c
Intra-Firm Information Flow: A Content-Structure Perspective,"Y. Berchenko, Or Daliot, N. Brueller",,https://www.semanticscholar.org/paper/026795cdf5b7347f31f571bd812a36065550739d,026795cdf5b7347f31f571bd812a36065550739d
MC 2 DR : Multi-cycle Deadlock Detection and Recovery Algorithm for Distributed Systems,"M. Razzaque, Md. Mamun-Or-Rashid, C. Hong",,https://www.semanticscholar.org/paper/5a875c2672d47fc41c465cdba9b2a2e1194e794c,5a875c2672d47fc41c465cdba9b2a2e1194e794c
Experimental Evaluation of Gel Fuel Droplet Burning Rates at Sub and Supercritical Conditions,"D. Bar-or, B. Natan","This paper concludes an experimental research on the combustion of gel fuel droplets. The research deals with a quantitative examination of the behavior of the combustion rate coefficient for gel fuel droplet s at pressures of 1 -40 atm at three different ambient oxygen nitrogen mixtures . The analysis includes 120 combustion experiments of gel fuel droplets, composed by 95% kerosene and 5% silva -gel. The droplet combustion was performed in a pressure chamber and was photographed using a high -speed video camera system. The research results provi de empirical correlations for the dependence of the burning rate coefficient of gel fuel droplets on the ambient pressure and on the oxygen -nitrogen composition. The results indicate that there are differences in the combustion behavior in the sub -critical and super -critical pressure regimes.",https://www.semanticscholar.org/paper/65c5af4b264bc8bef50f4376d2889495243e1185,65c5af4b264bc8bef50f4376d2889495243e1185
THE RESURRECTION MOTIF IN THE HEBREW BIBLE:,"L. Bronner, J. Knox, Allusions OR Illusions, L. Bronner",,https://www.semanticscholar.org/paper/4883ed3d9648b6fbab73c63d198194f7ec4fda45,4883ed3d9648b6fbab73c63d198194f7ec4fda45
A stable clustering method for efficient geographic routing in Mobile Ad-Hoc Networks,"Md.Mosaddek Khan, Md. Mamun-Or-Rashid","The Routing Approaches in Mobile Ad-hoc Network have almost entered the saturated arena. But still there are available options of perfection in this meadow. The task of improving the clustering technique is one of the fields which is under rated as a research topic for further improvement of routing. Clustering based MANET routing protocols, which are popular in terms of efficiency, simplicity and usability mostly use circular based clustering techniques. And the election of cluster head is done through the use conventional approaches. This particular paper is mainly focused to launch a new-fangled clustering technique through which it is possible to improve the routing performance of existing protocols. Another important aspect of this paper is to provide a cluster head selection algorithm which can effectively maintain the clusters and provides more stability. Proposed clustering idea is useful for geographically related nodes effectively in different turf of routing. To maintain the clusters and their stability, it provides a new idea to select cluster head within the cluster, also the election of secondary cluster head for avoiding further election immediately after the unavailability of primary cluster head. This idea is evaluated in network simulator and it outperforms the existing clustering techniques.",https://www.semanticscholar.org/paper/dbf3603d577d6373f6fb8a80e9870baabdaec0b0,dbf3603d577d6373f6fb8a80e9870baabdaec0b0
A Mixed-Bundling Pricing Strategy for the TV Advertising Market,"Mihai Banciu, Esther Gal‐Or, Prakash Mirchandani",,https://www.semanticscholar.org/paper/2e4fe9fe07db3f9cdafc9ce1e72cd7bbf0088bda,2e4fe9fe07db3f9cdafc9ce1e72cd7bbf0088bda
On the hybrid dynamics of planar mechanisms supported by frictional contacts. I: necessary conditions for stability,"Y. Or, E. Rimon","This paper is concerned with the stability of planar mechanisms supported by multiple frictional contacts against gravity. Stability of equilibrium postures is investigated under initial perturbations which may involve sliding or separation at the contacts. The frictional dynamics is formulated using the notion of contact modes, and the related problems of solution ambiguity and inconsistency are reviewed. The paper then uses the condition of strong equilibrium to eliminate ambiguities, and defines a new condition of kinematic-strong equilibrium which additionally eliminates frictional inconsistencies. It is then proven that strong equilibrium is necessary for stability of frictional equilibrium postures, and that kinematic-strong equilibrium guarantees finite-time recovery of an initially perturbed contact. The results are demonstrated on a reduced model of a rigid body having a variable center-of-mass and supported by two frictional contacts. A companion paper completes the analysis of this reduced problem by investigating the overall hybrid dynamics and deriving sufficient conditions for its stability.",https://www.semanticscholar.org/paper/fbd2f1278ae9744d4f90b4934d76b48564f556bd,fbd2f1278ae9744d4f90b4934d76b48564f556bd
Trainability of the Prepubescent Child.,"O. Bar-or, B. Goldberg","In brief: It is difficult to interpret studies of training-induced physiologic changes in prepubescents because the results may be confounded by the effects of growth and development. Thus studies of this group must carefully equate the training dose and include a control group. The research reviewed in this article indicates that aerobic power, muscle strength, and anaerobic muscle power are trainable. However, the degree of trainability of aerobic power seems somewhat lower in prepubescents than in more mature age-groups. Strength training is recommended for prepubescents only when needed for rehabilitation or for developing well-defined skills; lifting of maximal weights is discouraged.",https://www.semanticscholar.org/paper/a9c8035370b60d2974a5f9fc733692e08f412bdb,a9c8035370b60d2974a5f9fc733692e08f412bdb
"Result of video-education on ""genetic transmission in thalassemia"" to thalassemic patients and their parents.","S. Paholpak, A. Jetsrisuparb, S. Wiangnon, Darunee Sangsahachat, La-or Padtawaro",,https://www.semanticscholar.org/paper/d60df6b805c1d453d34897808f0f9c0038e125fb,d60df6b805c1d453d34897808f0f9c0038e125fb
Flow and Distribution of Fluid Phases through Porous Plant Growth Media in Microgravity: Progress to Date,"S. L. Steinberg, N. Daidzic, S. Jones, D. Or, G. Kluitenberg, L. Reddi, J. Alexander, M. Tuller",Results from plant growth experiments utilizing particulate growth media during space flight revealed difficulties associated with providing reliable reproducible gaseous and water supply to plant roots. These limitations were attributed to insufficient understanding of liquid configuration and growth media transport processes in reduced gravity. The objective of this NASA-funded research program is to develop a framework for modeling and quantitative characterization of physical processes associated with flow of wetting and non-wetting phases in particulate plant growth media in microgravity. This paper provides an overview of research plans and current status of research activities. Characterization and modeling of substrate water retention and transport properties in microgravity is key to management and control of gas and liquid fluxes within plant root zones. Modeling efforts will focus on both 1) a pore network model for describing discontinuous fluid phase transport (ganglia/blobs) and 2) a statistical distribution model describing water retention and hydraulic conductivity as functions of various pore configurations. Minimizing hydrostatic forces within porous media by using thin samples on earth may provide an approximation to microgravity conditions. In our preliminary study we have used Magnetic Resonance Imaging (MRI) to detect and track the evolution of liquid configuration and dynamics within thin slices of opaque porous media (Aquafoam with mean pore size of 50 μm). Both twoand three dimensional temporal MRI imaging has been performed in thin Aquafoam slices positioned vertically and horizontally (to simulate the effect of gravity). The wetting front exhibited percolation-type patterns and fingering. Preliminary results show that gravity dominates liquid flow even for low Bond numbers. Although the capillary forces are very strong the small hydrostatic pressure built in the initial liquid volume determines the subsequent evolution of the wetting front.,https://www.semanticscholar.org/paper/77c8ebeca3d177580a1b3910d1f2ae0042fa8529,77c8ebeca3d177580a1b3910d1f2ae0042fa8529
"Fast, continuous recirculation of germinal center B cell populations enhances robustness of immune response towards varying pathogens",M. Or-Guil,,https://www.semanticscholar.org/paper/311ba5842abac4889c15cf45d6fd8355f45bf503,311ba5842abac4889c15cf45d6fd8355f45bf503
Acm Sigact News Distributed Computing Column 31 Quantum Computers Meet Distributed Computing Can Quantum Mechanics Help Distributed Computing? Pseudo-telepathy Communication Complexity Other Communication Games Coin Tossing Quantum Proofs Classical Simulation of Entanglement Protocols for Quantum In,"I. Keidar, Anne Broadbent, Alain Tapp, Harry Buhrman, Wim Van Dam, Peter F. Hoyer, M Ben-Or, C. Crépeau, D. Gottesman, A. Hassidim, A. Smith, C. H. Bennett, G. Brassard, R. Jozsa, A. Peres, W. Wootters, Teleporting An Un, F. Clauser, M. A. Horne, A. Shimony, R. Holt, D M Greenberger, P Kaye, R. Laflamme, M. Mosca, A K Lenstra, H. Lenstra, M. Manasse, J. M. Pollard, D. Leung, B. Toner, R L Rivest, A. Shamir, L. Adleman, Vasil S. Denchev, Gopal Pandurangan",,https://www.semanticscholar.org/paper/61ac1104caa78032d0cfede2ee38c947d1513822,61ac1104caa78032d0cfede2ee38c947d1513822
WATER HYACINTH INFESTATION:,"Nuisance OR Nugget, P. Bolorunduro",,https://www.semanticscholar.org/paper/122f5c136d21ff659d7fd8e5519f531b62c1d0cf,122f5c136d21ff659d7fd8e5519f531b62c1d0cf
