Title,Authors,Abstract,URL,Paper ID
Guidelines for the use and interpretation of assays for monitoring autophagy (4th edition)1,"D. Klionsky, A. K. Abdel-Aziz, Sara Abdelfatah, M. Abdellatif, A. Abdoli, S. Abel, H. Abeliovich, Marie H Abildgaard, Y. P. Abudu, A. Acevedo-Arozena, I. Adamopoulos, K. Adeli, T. Adolph, A. Adornetto, E. Aflaki, G. Agam, A. Agarwal, B. Aggarwal, M. Agnello, P. Agostinis, J. Agrewala, A. Agrotis, P. Aguilar, S. T. Ahmad, Zubair M. Ahmed, Ulises Ahumada-Castro, S. Aits, S. Aizawa, Yunus Akkoç, Tonia Akoumianaki, Hafize Aysin Akpinar, A. M. Al-Abd, Lina Al-Akra, A. Al-Gharaibeh, M. Alaoui-Jamali, S. Alberti, E. Alcocer-Gómez, C. Alessandri, M. Ali, M. Alim Al-Bari, S. Aliwaini, Javad Alizadeh, Eugènia Almacellas, A. Almasan, A. Alonso, G. Alonso, N. Altan-Bonnet, D. Altieri, Elida M. C. Álvarez, S. Alves, C. Alves da Costa, Mazen M. Alzaharna, M. Amadio, C. Amantini, C. Amaral, Susanna Ambrosio, A. Amer, Veena Ammanathan, Zhenyi An, S. Andersen, S. Andrabi, Magaiver Andrade-Silva, Allen M. Andres, S. Angelini, D. Ann, Uche C. Anozie, M. Ansari, Pedro Antas, Adam Antebi, Zuriñe Antón, Tahira Anwar, L. Apetoh, N. Apostolova, T. Araki, Y. Araki, Kohei Arasaki, W. Araújo, J. Araya, C. Arden, M. Arevalo, Sandro Arguelles, E. Arias, J. Arikkath, H. Arimoto, Aileen R. Ariosa, D. Armstrong-James, Laetitia Arnauné-Pelloquin, Ángeles Aroca, D. Arroyo, I. Arsov, R. Artero, D. Asaro, M. Aschner, M. Ashrafizadeh, O. Ashur-Fabian, A. Atanasov, Alicia K. Au, P. Auberger, H. Auner, L. Aurelian, R. Autelli, L. Avagliano, Y. Ávalos, Sanja Aveic, C. Aveleira, Tamar Avin-Wittenberg, Yucel Aydin, S. Ayton, S. Ayyadevara, M. Azzopardi, M. Baba, J. Backer, Steven K. Backues, D. Bae, O. Bae, S. Bae, E. Baehrecke, Ahruem Baek, Seung-Hoon Baek, S. H. Baek, G. Bagetta, A. Bagniewska-Zadworna, Hua Bai, J. Bai, X. Bai, Yidong Bai, N. Bairagi, Shounak Baksi, T. Balbi, C. Baldari, W. Balduini, A. Ballabio, M. Ballester, S. Balazadeh, R. Balzan, R. Bandopadhyay, Sreeparna Banerjee, Sulagna Banerjee, Agnes Banreti, Yan Bao, M. Baptista, A. Baracca, C. Barbati, A. Bargiela, D. Barilà, Peter G. Barlow, S. Barmada, E. Barreiro, G. Barreto, J. Bartek, B. Bartel, Alberto Bartolomé, Gaurav Barve, S. Basagoudanavar, D. Bassham, R. Bast, A. Basu, H. Batoko, Isabella Batten, E. Baulieu, B. L. Baumgarner, J. Bayry, R. Beale, I. Beau, F. Beaumatin, Luiz R G Bechara, G. Beck, M. Beers, J. Begun, C. Behrends, G. Behrens, R. Bei, Eloy Bejarano, Shai Bel, C. Behl, Amine Belaid, Naïma Belgareh-Touzé, C. Bellarosa, F. Belleudi, Melissa Belló Pérez, R. Bello-Morales, J. O. Beltran, S. Beltrán, D. Benbrook, Mykolas Bendorius, B. Benitez, Irene Benito-Cuesta, Julien Bensalem, M. Berchtold, S. Berezowska, D. Bergamaschi, M. Bergami, A. Bergmann, L. Berliocchi, C. Berlioz-Torrent, Amélie Bernard, L. Berthoux, C. Besirli, Sébastien Besteiro, V. Betin, R. Beyaert, Jelena S. Bezbradica, K. Bhaskar, I. Bhatia-Kiššová, Resham Bhattacharya, S. Bhattacharya, S. Bhattacharyya, M. Bhuiyan, S. Bhutia, Lanrong Bi, X. Bi, T. J. Biden, K. Bijian, Viktor A. Billes, N. Binart, C. Bincoletto, Å. Birgisdottir, G. Bjørkøy, G. Blanco, A. Blas-García, J. Błasiak, Robert Blomgran, K. Blomgren, J. Blum, Emilio Boada-Romero, Mirta Boban, K. Boesze-Battaglia, Philippe Boeuf, B. Boland, P. Bomont, P. Bonaldo, S. Bonam, L. Bonfili, J. Bonifacino, B. Boone, M. Bootman, M. Bordi, C. Borner, B. Bornhauser, G. Borthakur, J. Bosch, S. Bose, L. Botana, J. Botas, C. Boulanger, M. Boulton, M. Bourdenx, Benjamin Bourgeois, Nollaig M. Bourke, G. Bousquet, P. Boya, P. Bozhkov, L. Bozi, T. Bozkurt, D. Brackney, C. Brandts, R. Braun, G. Braus, R. Bravo-Sagua, J. M. Bravo-San Pedro, P. Brest, M. Bringer, Alfredo Briones-Herrera, V. Broaddus, P. Brodersen, J. Brodsky, S. Brody, P. Bronson, J. Bronstein, C. N. Brown, Rhoderick E. Brown, P. Brum, J. Brumell, N. Brunetti‐Pierri, D. Bruno, R. Bryson-Richardson, C. Bucci, C. Buchrieser, M. Bueno, L. E. Buitrago‐Molina, Simone Buraschi, S. Buch, J. Buchan, E. Buckingham, H. Budak, M. Budini, G. Bultynck, F. Burada, J. Burgoyne, M. Burón, Victor H. Bustos, S. Büttner, Elena Butturini, Aaron Byrd, I. Cabas, Sandra Cabrera-Benitez, K. Cadwell, Jingjing Cai, L. Cai, Qian Cai, M. Cairó, J. Calbet, G. Caldwell, Kim A. Caldwell, J. Call, R. Calvani, A. Calvo, Miguel Calvo-Rubio Barrera, N. O. Câmara, J. Camonis, N. Camougrand, M. Campanella, E. Campbell, François-Xavier Campbell-Valois, S. Campello, I. Campesi, Juliane C Campos, O. Camuzard, J. Cancino, Danilo Candido de Almeida, L. Canesi, I. Caniggia, B. Canonico, C. Cantí, Bin Cao, M. Caraglia, B. Caramés, E. Carchman, E. Cardenal-Muñoz, C. Cárdenas, L. Cárdenas, S. Cardoso, J. Carew, G. Carle, G. Carleton, S. Carloni, D. Carmona-Gutierrez, L. Carneiro, O. Carnevali, Julian M. Carosi, S. Carra, A. Carrier, L. Carrier, Bernadette Carroll, A. Carter, A. N. Carvalho, M. Casanova, Caty Casas, J. Casas, Chiara Cassioli, Eliseo F. Castillo, K. Castillo, Sonia Castillo-Lluva, F. Castoldi, M. Castori, A. F. Castro, M. Castro-Caldas, J. Castro-Hernandez, S. Castro-Obregón, S. Catz, C. Cavadas, F. Cavaliere, G. Cavallini, M. Cavinato, M. Cayuela, Paula Cebollada Rica, V. Cecarini, F. Cecconi, M. Cechowska-Pasko, S. Cenci, V. Ceperuelo-Mallafré, J. Cerqueira, J. Cerutti, D. Cervia, V. Cetintas, S. Cetrullo, H. Chae, A. Chagin, C. Chai, Gopal Chakrabarti, Oishee Chakrabarti, T. Chakraborty, T. Chakraborty, Mounia Chami, Georgios Chamilos, D. Chan, Edmond Y. W. Chan, E. Chan, H. Chan, H. H. Chan, H. Chan, M. Chan, Y. Chan, Partha K. Chandra, Chih-Peng Chang, Chunmei Chang, Hao-Chun Chang, K. Chang, J. Chao, T. Chapman, N. Charlet-Berguerand, S. Chatterjee, S. K. Chaube, A. Chaudhary, S. Chauhan, E. Chaum, F. Checler, M. Cheetham, Chang-Shi Chen, Guang-Chao Chen, Jian-Fu Chen, Liam Chen, Leilei Chen, Lin Chen, Mingliang Chen, Mu-Kuan Chen, Ning Chen, Quan Chen, Ruey-Hwa Chen, Shi Chen, Wei Chen, Weiqiang Chen, Xinming Chen, Xiong-Wen Chen, Xu Chen, Yan Chen, Ye-Guang Chen, Yingyu Chen, Yongqiang Chen, Yu-Jen Chen, Yue‐Qin Chen, Z. Chen, Zhi Chen, Zhihua Chen, Zhijian J. Chen, Zhixiang Chen, Hanhua Cheng, Jun Cheng, Shi-Yuan Cheng, W. Cheng, Xiaodong Cheng, Xiu-Tang Cheng, Yiyun Cheng, Zhiyong Cheng, Zhong Chen, H. Cheong, J. K. Cheong, B. Chernyak, S. Cherry, C. Cheung, C. Cheung, K. Cheung, É. Chevet, Richard J. Chi, A. Chiang, F. Chiaradonna, R. Chiarelli, M. Chiariello, Nathalia Chica, S. Chiocca, M. Chiong, S. Chiou, Abhilash I. Chiramel, V. Chiurchiù, D. Cho, Seong-Kyu Choe, A. Choi, Mary E. Choi, Kamalika Roy Choudhury, Norman S. Chow, C. Chu, Jason P. Chua, J. J. Chua, Hyewon Chung, Kin Pan Chung, Seockhoon Chung, So-Hyang Chung, Yuen-Li Chung, V. Cianfanelli, I. Ciechomska, M. Cifuentes, Laura Cinque, S. Çırak, M. Cirone, M. J. Clague, R. Clarke, E. Clementi, E. Coccia, P. Codogno, E. Cohen, Mickael M. Cohen, T. Colasanti, Fiorella Colasuonno, R. Colbert, A. Colell, M. Čolić, N. Coll, M. Collins, M. Colombo, Daniel A. Colón-Ramos","ABSTRACT In 2008, we published the first set of guidelines for standardizing research in autophagy. Since then, this topic has received increasing attention, and many scientists have entered the field. Our knowledge base and relevant new technologies have also been expanding. Thus, it is important to formulate on a regular basis updated guidelines for monitoring autophagy in different organisms. Despite numerous reviews, there continues to be confusion regarding acceptable methods to evaluate autophagy, especially in multicellular eukaryotes. Here, we present a set of guidelines for investigators to select and interpret methods to examine autophagy and related processes, and for reviewers to provide realistic and reasonable critiques of reports that are focused on these processes. These guidelines are not meant to be a dogmatic set of rules, because the appropriateness of any assay largely depends on the question being asked and the system being used. Moreover, no individual assay is perfect for every situation, calling for the use of multiple techniques to properly monitor autophagy in each experimental setting. Finally, several core components of the autophagy machinery have been implicated in distinct autophagic processes (canonical and noncanonical autophagy), implying that genetic approaches to block autophagy should rely on targeting two or more autophagy-related genes that ideally participate in distinct steps of the pathway. Along similar lines, because multiple proteins involved in autophagy also regulate other cellular pathways including apoptosis, not all of them can be used as a specific marker for bona fide autophagic responses. Here, we critically discuss current methods of assessing autophagy and the information they can, or cannot, provide. Our ultimate goal is to encourage intellectual and technical innovation in the field.",https://www.semanticscholar.org/paper/6737c2627bcad064410a48f8077e3ca455fa0639,6737c2627bcad064410a48f8077e3ca455fa0639
Mitigating Data Injection Attacks on Federated Learning,"O. Shalom, Amir Leshem, W. U. Bajwa","Federated learning is a technique that allows multiple entities to collaboratively train models using their data without compromising data privacy. However, despite its advantages, federated learning can be susceptible to false data injection attacks. In these scenarios, a malicious entity with control over specific agents in the network can manipulate the learning process, leading to a suboptimal model. Consequently, addressing these data injection attacks presents a significant research challenge in federated learning systems. In this paper, we propose a novel approach to detect and mitigate data injection attacks on federated learning systems. Our mitigation strategy is a local scheme, performed during a single instance of training by the coordinating node, allowing for mitigation during the convergence of the algorithm. Whenever an agent is suspected of being an attacker, its data will be ignored for a certain period; this decision will often be re-evaluated. We prove that with probability one, after a finite time, all attackers will be ignored while the probability of ignoring a trustful agent becomes zero, provided that there is a majority of truthful agents. Simulations show that when the coordinating node detects and isolates all the attackers, the model recovers and converges to the truthful model.",https://www.semanticscholar.org/paper/44e9f1b8405c3f62b0ad7c1d2d08d8ac533e0675,44e9f1b8405c3f62b0ad7c1d2d08d8ac533e0675
Distributions of Flux and Electromagnetic Force in Brushless Motor Using 3-D FEM,"A. Bunmat, Pongpisit Saikham, P. Pao-la-or","This paper presents a mathematical model of the electromagnetic field. and the electromagnetic force of a DC brushless electric motor. The 3-D finite element method (3-D FEM) was applied to analyze the electromagnetic field. and electromagnetic forces in the design of DC brushless electric motors. In this research, the design of a three-phase, four-pole, 3-hp DC brushless electric motor is considered in two forms: 6 permanent magnets and 10 permanent magnets, but the magnetic properties and parameters. remain the same, and the results shown are the values of the magnetic field distributed along the motor cross-sectional area. This is explained by a graphical representation of the magnetic field distribution. To determine the electromagnetic load of a brushless motor in an analysis of the ideal DC brushless motor design.",https://www.semanticscholar.org/paper/160060d43d02bcaf9a7f17f6e8937e0a17dcd840,160060d43d02bcaf9a7f17f6e8937e0a17dcd840
Insights into abusive workplace behavior,"Aharon Tziner, Hadara Bar-Mor, Daphna Shwartz-Asher, Or Shkoler, Lilach Geva, Haim Levi","Objectives This paper explores definitions, incidences, and outcomes of workplace abuse – a widespread, worldwide social phenomenon impinging on the well-being of workers in a developing labor market – and possible directions for delineating and standardizing classifications of the phenomenon that facilitate workers’ protection. Furthermore, we employ Tepper’s Abusive Supervision Survey Questionnaire [ASSQ] to identify managerial abuse in organizations regarding the type of organization (public/private), gender of the perpetrator, gender of the target, and the managerial role, of each of the abuse items. Finally, we suggest directions for further research and practical measures designed to facilitate the diminution of behavioral abuse in the workplace in the foreseeable future. Hypotheses No hypotheses are submitted in this exploratory paper. Methods Employees of two large organizations (the Katzrin Local Council and Tigbur Ltd.) and another small national organization in Israel were approached, requesting their assistance in this investigation. We introduced the questionnaire, noting its anonymity and the academic context, and that subject participation was voluntary. The questionnaire consisted of fifteen statements on a five-point response scale ranging from 1 = “I cannot remember him/her ever using this behavior with me” to 5 = “He/she uses this behavior very often with me” (alpha = 0.97, M = 1.81, SD = 1.03). One hundred five respondents comprised the final sample: men (39%) and women (61%) aged 23–66. 66.7% of the respondents were employed in a public organization, 28.5% in a private organization, and 4.8% in a national organization. Years of education: less than 12 (14.3%); 12 full years (17.1%); tertiary education (10.5%); bachelor’s degree (40%); and master’s degree and above (18.1%). While 28.6% held managerial positions, 71.4% did not. Job tenure ranged between 0.5 and 42 years. The participants in national and private organizations were combined to avoid the problem of unbalanced groups. Notably, the gender balance of the managers was men (50.5%) and women (49.5%). To ensure statistical validity, we conducted a factor analysis and performed Pearson correlations to examine the relationships between the general latent variable and the abuse items and their intercorrelations. Additionally, we conducted t-tests for independent samples (with Bonferroni corrections for multiple comparisons: see, for example) to compare (1) the respondent’s gender; (2) manager’s gender; and (3) the managerial role with each of the abuse items, and (4) the type of organization (private/public); including the general abuse variable. Results High, positive, and significant correlations were recorded between each questionnaire item and the total score of abusive behavior. The results ranged from r = 0.92 for the statement, “Puts me down in front of others” (r = 0.92) to r = 0.69 for the statement, “Does not allow me to interact with my co-workers” (r = 0.69). Reported abuse in the respondents’ organizations was relatively low (1.81), while among women managers marginally less than their male equivalents (in absolute value, the mean difference in the mean scores fell between 0.28 and 1.25). Abusive behavior in private organizations was more prevalent than in public concerns. Not surprisingly, workers reported more incidents of abuse than managers: in absolute value, the mean difference between employees and managers fell between 0 and 0.67 in the mean scores. Women reported fewer abusive behavior incidents than men; however, the differences found were insignificant. Conclusion The reports of abusive behaviors were meager. Explanations include: (1) Any instance of alleged workplace abuse can be interpreted variously by different individuals, a function of subjective perceptions and interpretations of objective data informed by several internal and external factors impinging on workers’ wellness at work. (2) The extant “trust gap,” which is part of the pervading culture, mitigates against honest reporting of workplace abuse for fear of reprisals. (3) A single report of behavioral abuse at work may be attributable to the same perpetrator repeating the aggression several times. The lower incidence of reported abuse among female managers could be understood in line with studies that indicate that men display aggression more frequently than women playing out their expected respective stereotypical roles in society. Furthermore, following women reflect more stable personality dispositions and are less likely than men to aggress against others without provocation. In line with these observations, women’s management style projects “an ethics of care,” focusing on interpersonal relations and a greater tendency than male managers toward cooperation, creativity, innovation, and shared decision-making. Because the differences found in all the variables in our investigation investigated were not significant, we cannot conclude that the results indicate a trend. Finally, we assume that appropriate sanctions against perpetrators at the workplace and regulation in public organizations would reduce the incidence of workplace abuse. In a more optimistic vein, we recommend that management and HR personnel initiate positive measures to raise awareness of behavioral abuse and eliminate it from their organizations. They should initiate training workshops, events, and support groups akin to those extant in organizations focused on eliminating racial prejudice and advocating sustainability and wellness in the workplace. Ultimately, the goal is to protect workers’ dignity, the integrity of the organizations, and the welfare of society.",https://www.semanticscholar.org/paper/6aff04b9f0c9238b2c458dd5f570482352137bf4,6aff04b9f0c9238b2c458dd5f570482352137bf4
The PICO Framework for Analysis and Design of Production Systems for Construction,"Li-Or Sharoni, R. Sacks, T. Yeung, O. Alhava, E. Laine, Jhonattan Guillermo Martinez Ribón","PICO is a framework that provides a conceptual guide for production system analysis and design in the construction industry. It has four key components: Production control mechanism, Information and communication system, Commercial terms, and Organizational structure. Each component is highly interdependent and has a set of detailed parameters and enumerated values. A comprehensive literature review, case studies, and analysis highlighted the knowledge gaps in current production system design frameworks. The PICO framework was originally devised to design a production system suited for short-takt production in residential construction, but it has been developed into a comprehensive mapping tool for the design and analysis of construction production systems in general. The paper shows an application of the framework to a takt system as a case study and an example of its application. The framework expands the current understanding of production systems in construction, offering new insights and a comprehensive approach to designing new production systems.",https://www.semanticscholar.org/paper/bbe4a94bd33f9d72ddee40639120cc9b0dcb19c2,bbe4a94bd33f9d72ddee40639120cc9b0dcb19c2
Multimedia Semantics: Interactions Between Content and Community Research on pattern analysis and monitoring of web-based social communities is reviewed in this paper; the authors study how media-rich social networks provide insight into multimedia research problems.,"H. Sundaram, Lexing Xie, M. Choudhury, Y. Lin, Apostol Natsev",,https://www.semanticscholar.org/paper/e65bae00082ca1c51313205851c47a773fb78b3d,e65bae00082ca1c51313205851c47a773fb78b3d
GA-USTAR phase 1: Development and flight testing of the baseline upset and stall research aircraft,"Or D. Dantsker, G. Ananda, M. Selig","The General Aviation Upset and Stall Testing Aircraft Research (GA-USTAR) project described in this paper aims to develop a dynamically-scaled, Reynolds number corrected, GA aircraft to provide validation data sets for the stall/upset aerodynamic model development. This paper describes the first of three phases of the GA-USTAR project, where the baseline aircraft was developed such that future modifications could be performed to dynamically-scale and then perform Reynolds number corrections to the aircraft. From the possible GA aircraft radio control models available, a 1/5-scale model Cessna 182 was chosen. The aircraft was first built as a radio control model with modifications being made to support future activities. The aircraft was instrumented with a high-fidelity data acquisition system, which was then used to collect baseline flight characteristics of the aircraft. Extensive flight testing was carried out with flight maneuvers performed according flight simulator qualification standards. A sampling of these maneuvers together with all aircraft state details is presented. These maneuvers included idle decent (gliding), elevator-induced phugoid dynamics, roll rate response, rudder response, stall (clean) with low rate elevator deflections, stall (clean) with high rate elevator deflections, and finally stall (half flaps) with high rate elevator deflections. The results presented show high quality aircraft state data that in the future will be used for validation of flight simulation aerodynamic models.",https://www.semanticscholar.org/paper/897bef8e63bd3d97c7db3e34e557683642ebafe5,897bef8e63bd3d97c7db3e34e557683642ebafe5
"Evaluating the clinical utility of Aspergillus, Mucorales, and Nocardia bronchoalveolar PCRs for the diagnosis of invasive pulmonary infections in patients with hematological malignancies","Varshini Gali, Rakan Al-Ghanamah, Katie Finnigan, O. Kalchiem-Dekel, M. Kamboj, Tobias M. Hohl, N. Babady, G. Papanicolaou, Yeon Joo Lee","ABSTRACT Invasive pulmonary infections are a significant cause of morbidity and mortality in patients with hematological malignancies and hematopoietic stem cell transplantation (HCT) recipients. A delay in identifying a causative agent may result in late initiation of appropriate treatment and adverse clinical outcomes. We examine the diagnostic utility of PCR-based assays in evaluating invasive pulmonary infections from bronchoalveolar lavage (BAL). Patients with hematological malignancies and HCT recipients who underwent bronchoscopy with BAL from January 2020 to January 2024 for unexplained pulmonary infiltrates and had ≥1 PCR targeting Aspergillus, Mucorales, or Nocardia (Eurofins-Viracor, KS) were reviewed. Testing for microbiology and pathology except BAL PCRs to identify the etiology of pulmonary infiltrate was defined as standard-of-care. Invasive fungal diseases were defined as per European Organization for Research and Treatment of Cancer and the Mycoses Study Group Education and Research Consortium (EORTC/MSGERC) 2020 guidelines. Pulmonary nocardiosis was defined by a combination of clinical, radiographic, and microbiologic criteria. Of 134 patients, 77 were HCT recipients, and 70% were on antifungal agents. Thirty-two were diagnosed with infection with one of the three target pathogens, including 20 with probable or proven invasive pulmonary aspergillosis (IPA), seven with mucormycosis, and three with nocardiosis. For IPA, 19 were diagnosed by standard-of-care, and one (5%) was solely diagnosed by Aspergillus PCR. Mucorales PCR was positive in three of seven cases of proven mucormycosis, but the cultures were negative in all. All three nocardiosis cases were detected by PCR and culture. In our cohort, PCR targeting Mucorales and Nocardia can improve the early detection of invasive pulmonary infection, whereas Aspergillus PCR has a low added value when done in conjunction with standard-of-care, including BAL galactomannan. IMPORTANCE Invasive pulmonary infections are a significant cause of morbidity and mortality in immunocompromised patients. Timely diagnosis of invasive pulmonary infection reduces the time to targeted treatment initiation and improves clinical outcomes. The recent European Organization for Research and Treatment of Cancer and the Mycoses Study Group Education and Research Consortium (EORTC/MSGERC) update included the addition of serum or bronchoalveolar lavage (BAL) PCR as a method to determine probable Aspergillus disease. This reflects an increased utilization of PCR-based assays in the diagnosis of fungal diseases. Although PCR assays for Aspergillus diagnosis have been well characterized in the literature, their additive clinical utility in conjunction with BAL galactomannan index measurements remains unclear. Moreover, only a few reports characterize the analytic and clinical performance of Mucorales and Nocardia PCR.",https://www.semanticscholar.org/paper/9f57df658df3e51858645d25f21c0c655780fc49,9f57df658df3e51858645d25f21c0c655780fc49
